{
 "t": 1792889705.0298731,
 "group": "239.255.208.108:4321",
 "pkts": 10291022,
 "pps": 2978.3569146867685,
 "loss_pct": 0.8114828711618304,
 "gaps": 2882,
 "backwards": 0,
 "bad": 0,
 "blocks": 644716,
 "blocks_all_zero_frac": 0.0,
 "state": "ok",
 "nch": 8,
 "channels": [
  4
 ],
 "targets": [
  "192.0.2.10:48200"
 ],
 "uptime_s": 3480.2545580863953
}
